{
  "packet_type": "skill",
  "canonical_name": "opencode-event-log-compactor",
  "source_path": "C:\\Users\\DaveWitkin\\.opencode-lazy-vault\\opencode-event-log-compactor\\SKILL.md",
  "selected": true,
  "rank": 16,
  "functional_verdict": "FUNCTIONAL_SMOKE_TEST_UNVERIFIED",
  "functional_evidence": {
    "harness_structural_result": "FAIL",
    "harness_exit_code": 1,
    "harness_summary_excerpt": "SKILL SMOKE TEST SUMMARY\nSTRUCTURE: OK (PASS x5)\nREFERENCES: OK (WARN x12)\nSCRIPT SYNTAX: FAIL (PASS x12, FAIL x1)\nRESULT: FAIL",
    "functional_verdict_reason": "requires compacting/archiving logs (destructive mutation); additionally STRUCTURAL script-syntax FAIL so functional confirmation moot",
    "safe_dispatch_policy": "no live functional case dispatched; credentials/external mutation/network/destructive ops/orchestration dispatch prohibited in review-only track"
  },
  "items": [
    {
      "id": "NAME_02_SKILL_MD_CASE",
      "result": "Pass",
      "severity": "Info",
      "confidence": "high",
      "source_path": "C:\\Users\\DaveWitkin\\.opencode-lazy-vault\\opencode-event-log-compactor\\SKILL.md",
      "evidence": "SKILL.md exists with exact all-caps casing at skill root"
    },
    {
      "id": "NAME_01_FOLDER_SLUG",
      "result": "Pass",
      "severity": "Info",
      "confidence": "high",
      "source_path": "C:\\Users\\DaveWitkin\\.opencode-lazy-vault\\opencode-event-log-compactor",
      "evidence": "folder 'opencode-event-log-compactor' matches lowercase-hyphen slug regex"
    },
    {
      "id": "NAME_03_FRONTMATTER_REQUIRED",
      "result": "Pass",
      "severity": "Info",
      "confidence": "high",
      "source_path": "C:\\Users\\DaveWitkin\\.opencode-lazy-vault\\opencode-event-log-compactor\\SKILL.md",
      "evidence": "YAML frontmatter present and parses"
    },
    {
      "id": "NAME_04_UNIQUE_IDENTITY",
      "result": "Pass",
      "severity": "Info",
      "confidence": "high",
      "source_path": "C:\\Users\\DaveWitkin\\.opencode-lazy-vault\\opencode-event-log-compactor",
      "evidence": "canonical name 'opencode-event-log-compactor' resolved uniquely via usage-ranking selection (deduped by canonical identity)"
    },
    {
      "id": "NAME_05_REGEX_AND_LENGTH",
      "result": "Pass",
      "severity": "Info",
      "confidence": "high",
      "source_path": "C:\\Users\\DaveWitkin\\.opencode-lazy-vault\\opencode-event-log-compactor\\SKILL.md",
      "evidence": "frontmatter name='opencode-event-log-compactor' len=28 matches name regex/length"
    },
    {
      "id": "DESC_01_WHAT_WHEN_KEYWORDS",
      "result": "Pass",
      "severity": "Info",
      "confidence": "high",
      "source_path": "C:\\Users\\DaveWitkin\\.opencode-lazy-vault\\opencode-event-log-compactor\\SKILL.md",
      "evidence": "description states what/when; length=600 keyword-hits=3"
    },
    {
      "id": "DESC_02_LENGTH",
      "result": "Fail",
      "severity": "Minor",
      "confidence": "high",
      "source_path": "C:\\Users\\DaveWitkin\\.opencode-lazy-vault\\opencode-event-log-compactor\\SKILL.md",
      "evidence": "description length=600 outside 20-400 bounds"
    },
    {
      "id": "DESC_03_NOT_VAGUE",
      "result": "Pass",
      "severity": "Info",
      "confidence": "high",
      "source_path": "C:\\Users\\DaveWitkin\\.opencode-lazy-vault\\opencode-event-log-compactor\\SKILL.md",
      "evidence": "description specific (no vague markers); heuristic metric"
    },
    {
      "id": "FM_01_OPTIONAL_FIELDS_JUSTIFIED",
      "result": "Pass",
      "severity": "Info",
      "confidence": "high",
      "source_path": "C:\\Users\\DaveWitkin\\.opencode-lazy-vault\\opencode-event-log-compactor\\SKILL.md",
      "evidence": "frontmatter keys=['description', 'name']; unknown=[] (unknown keys ignored by OpenCode)"
    },
    {
      "id": "TRIG_03_UNKNOWN_KEYS_NOT_RELIED_ON",
      "result": "Pass",
      "severity": "Info",
      "confidence": "high",
      "source_path": "C:\\Users\\DaveWitkin\\.opencode-lazy-vault\\opencode-event-log-compactor\\SKILL.md",
      "evidence": "review notes OpenCode ignores unknown frontmatter keys; skill must not depend on them"
    },
    {
      "id": "STRUCT_01_ENTRYPOINT_SIZE",
      "result": "Fail",
      "severity": "Minor",
      "confidence": "high",
      "source_path": "C:\\Users\\DaveWitkin\\.opencode-lazy-vault\\opencode-event-log-compactor\\SKILL.md",
      "evidence": "SKILL.md size=15917 exceeds 8000-byte conciseness bound"
    },
    {
      "id": "STRUCT_02_ADVANCED_DETAILS_DISCLOSED",
      "result": "Fail",
      "severity": "Minor",
      "confidence": "high",
      "source_path": "C:\\Users\\DaveWitkin\\.opencode-lazy-vault\\opencode-event-log-compactor\\SKILL.md",
      "evidence": "no internal references found; advanced details not disclosed"
    },
    {
      "id": "STRUCT_03_ONE_LEVEL_REFERENCES",
      "result": "Pass",
      "severity": "Info",
      "confidence": "high",
      "source_path": "C:\\Users\\DaveWitkin\\.opencode-lazy-vault\\opencode-event-log-compactor\\SKILL.md",
      "evidence": "internal references all resolve (one level deep); checked=0 broken=0"
    },
    {
      "id": "GUARD_01_GOTCHAS",
      "result": "Pass",
      "severity": "Info",
      "confidence": "high",
      "source_path": "C:\\Users\\DaveWitkin\\.opencode-lazy-vault\\opencode-event-log-compactor\\SKILL.md",
      "evidence": "gotchas/guardrails section present"
    },
    {
      "id": "GUARD_02_DEFAULT_AND_ALTERNATIVES",
      "result": "Pass",
      "severity": "Info",
      "confidence": "high",
      "source_path": "C:\\Users\\DaveWitkin\\.opencode-lazy-vault\\opencode-event-log-compactor\\SKILL.md",
      "evidence": "default/alternative/fallback guidance present"
    },
    {
      "id": "GUARD_03_CONCISE_ACTIONABLE_EXAMPLES",
      "result": "Pass",
      "severity": "Info",
      "confidence": "high",
      "source_path": "C:\\Users\\DaveWitkin\\.opencode-lazy-vault\\opencode-event-log-compactor\\SKILL.md",
      "evidence": "actionable examples/code blocks present"
    },
    {
      "id": "PATH_01_FORWARD_SLASH_DOCS",
      "result": "Pass",
      "severity": "Info",
      "confidence": "high",
      "source_path": "C:\\Users\\DaveWitkin\\.opencode-lazy-vault\\opencode-event-log-compactor\\SKILL.md",
      "evidence": "markdown links use forward slashes; backslash-link count=0"
    },
    {
      "id": "PATH_02_COMPATIBILITY",
      "result": "Pass",
      "severity": "Info",
      "confidence": "high",
      "source_path": "C:\\Users\\DaveWitkin\\.opencode-lazy-vault\\opencode-event-log-compactor\\SKILL.md",
      "evidence": "compatibility noted (fm=False body=True)"
    },
    {
      "id": "TEST_01_ACTIVATION",
      "result": "Pass",
      "severity": "Info",
      "confidence": "high",
      "source_path": "C:\\Users\\DaveWitkin\\.opencode-lazy-vault\\opencode-event-log-compactor\\SKILL.md",
      "evidence": "activation guidance present (triggers=False body-section=True)"
    },
    {
      "id": "TEST_02_SAFE_END_TO_END",
      "result": "Pass",
      "severity": "Info",
      "confidence": "high",
      "source_path": "C:\\Users\\DaveWitkin\\.opencode-lazy-vault\\opencode-event-log-compactor\\SKILL.md",
      "evidence": "safe end-to-end evidence present (tests/=True body=True)"
    },
    {
      "id": "TEST_05_STRUCTURAL_AND_FUNCTIONAL",
      "result": "Pass",
      "severity": "Info",
      "confidence": "high",
      "source_path": "C:\\Users\\DaveWitkin\\.opencode-lazy-vault\\opencode-event-log-compactor\\SKILL.md",
      "evidence": "structural checks run now; functional smoke is a separate layer (Task 2.2)"
    },
    {
      "id": "TEST_06_TEST_CASE_CONVENTION",
      "result": "Pass",
      "severity": "Info",
      "confidence": "high",
      "source_path": "C:\\Users\\DaveWitkin\\.opencode-lazy-vault\\opencode-event-log-compactor\\SKILL.md",
      "evidence": "tests/ directory present (test-case convention followed)"
    },
    {
      "id": "HANDOFF_01_PUBLISH_DECISION",
      "result": "Not Applicable",
      "severity": "Info",
      "confidence": "high",
      "source_path": "C:\\Users\\DaveWitkin\\.opencode-lazy-vault\\opencode-event-log-compactor\\SKILL.md",
      "evidence": "review-only; no publish requested (publication prohibited in this track)",
      "applicability_reason": "review-only; no publish requested (publication prohibited in this track)"
    },
    {
      "id": "TROUBLE_01_YAML",
      "result": "Pass",
      "severity": "Info",
      "confidence": "high",
      "source_path": "C:\\Users\\DaveWitkin\\.opencode-lazy-vault\\opencode-event-log-compactor\\SKILL.md",
      "evidence": "frontmatter YAML parses (yaml_ok=True)"
    },
    {
      "id": "TROUBLE_02_UNIQUENESS",
      "result": "Pass",
      "severity": "Info",
      "confidence": "high",
      "source_path": "C:\\Users\\DaveWitkin\\.opencode-lazy-vault\\opencode-event-log-compactor\\SKILL.md",
      "evidence": "canonical identity unique within the 20-skill selection"
    },
    {
      "id": "TROUBLE_03_PERMISSION_VISIBILITY",
      "result": "Pass",
      "severity": "Info",
      "confidence": "high",
      "source_path": "C:\\Users\\DaveWitkin\\.opencode-lazy-vault\\opencode-event-log-compactor\\SKILL.md",
      "evidence": "permission visibility reviewed; sensitive=True (triggers PERM_* conditional items)"
    },
    {
      "id": "TROUBLE_04_REFERENCE_EXISTENCE",
      "result": "Pass",
      "severity": "Info",
      "confidence": "high",
      "source_path": "C:\\Users\\DaveWitkin\\.opencode-lazy-vault\\opencode-event-log-compactor\\SKILL.md",
      "evidence": "referenced files checked; broken=0"
    },
    {
      "id": "SCOPE_01_ONE_CAPABILITY",
      "result": "Pass",
      "severity": "Info",
      "confidence": "high",
      "source_path": "C:\\Users\\DaveWitkin\\.opencode-lazy-vault\\opencode-event-log-compactor\\SKILL.md",
      "evidence": "skill scoped to one capability per name/description; size=15917"